{"aggregation":{"claimed_capacity":null,"highest_planning_step_passed":null,"state":"unexecuted"},"authority":"offline-deterministic-mocked-load-plan-only","blockers":["S5_06_NOT_ACCEPTED","STEP_APPROVALS_ABSENT","REAL_SANDBOX_RESULTS_ABSENT"],"claims":{"campaign_authorized":false,"capacity_validated":false,"cloud_execution_observed":false,"production_ready":false,"release_eligible":false},"execution_route":{"cluster":false,"deployment":false,"external_model":false,"provider":false,"scheduler":false},"issues":[370,371],"steps":[{"evidence_binding_sha256":null,"execution":"unexecuted","gates":{"cross_user_isolation_required":true,"exclusive_same_project_writer_required":true,"four_session_user_probe_required":true,"stop_before_next_on_failure_or_uncertainty":true},"metrics":["startup","scheduling","resources","proxy","openbao","ssh","storage","wal","otlp","cost","cleanup"],"model_mode":"deterministic-mocked-only","per_user_session_limit":4,"prior_passing_target_required":null,"result":null,"target_active_sessions":10},{"evidence_binding_sha256":null,"execution":"unexecuted","gates":{"cross_user_isolation_required":true,"exclusive_same_project_writer_required":true,"four_session_user_probe_required":true,"stop_before_next_on_failure_or_uncertainty":true},"metrics":["startup","scheduling","resources","proxy","openbao","ssh","storage","wal","otlp","cost","cleanup"],"model_mode":"deterministic-mocked-only","per_user_session_limit":4,"prior_passing_target_required":10,"result":null,"target_active_sessions":25},{"evidence_binding_sha256":null,"execution":"unexecuted","gates":{"cross_user_isolation_required":true,"exclusive_same_project_writer_required":true,"four_session_user_probe_required":true,"stop_before_next_on_failure_or_uncertainty":true},"metrics":["startup","scheduling","resources","proxy","openbao","ssh","storage","wal","otlp","cost","cleanup"],"model_mode":"deterministic-mocked-only","per_user_session_limit":4,"prior_passing_target_required":25,"result":null,"target_active_sessions":50}],"version":"cogs.stage5-load-plan/v1"}
